Udvari B.|2019|A nemzetközi fejlesztési együttműködés átalakuló rendszere: alapfogalmak, változó célok és modalitások.|In Kiss J. (szerk.): Nemzetközi segélyezés a 21. század elején. Akadémiai Kiadó, Budapest, 9-49.
Udvari B. – Urbánné M. J.|2018|Afrika fejlődésének új alapja? Az Európai Unió és Afrika kutatási együttműködése.|Külgazdaság, 7-8, 56-88.
Udvari B. – Kis K. – Halmosi P.|2018|Generosity or Economic Reasons? – Motivations of Kuwait and the United Arab Emirates for Aid Allocations.|International Journal of Diplomacy and Economy, 4, 2, 81-106.
Udvari B. – Vas Zs.|2017|Nemzetközi fejlesztési segélyezés az innováció területén.|Külgazdaság, 7–8, 74–101.
Udvari B. – Kiss G. D. – Kis K. – Pontet J. – Halmosi P.|2017|Kuvait mint arab donor segélyezése.|Külgazdaság, 3–4, 74–101.
Udvari B.|2014|Realignment in international development cooperation: Role of emerging donors.|Society and Economy, 3, 407–426.
Udvari B.|2012|Az EU és a fejlődő országok kapcsolata: Az Aid for Trade szerepe.|Köz-Gazdaság, 4, 95–110.
Udvari B.|2010|Mindenki ugyanannyit veszít? – A fejlődő országok és a TRIPS Egyezmény gyógyszerkereskedelemre vonatkozó szabályai.|Fordulat, 8, 84–104.
